{
  "$schema": "http://json-schema.org/draft-07/schema#",
  "$ref": "#/definitions/CompetitorDetail",
  "definitions": {
    "CompetitorDetail": {
      "type": "object",
      "additionalProperties": true,
      "required": [
        "competitorFromDate",
        "id"
      ],
      "properties": {
        "id": {
          "anyOf": [
            {
              "type": "string"
            },
            {
              "type": "null"
            }
          ]
        },
        "auditDetail": {
          "description": "Defines standard system audit fields available for most types",
          "example": {
            "createdOn": "2021-01-21T21:21:21Z",
            "createdBy": "0054x000002IpBlAAK",
            "updatedOn": "2021-01-21T21:21:21Z",
            "updatedBy": "0054x000002xBGGAA2",
            "isDeleted": false
          },
          "type": "object",
          "additionalProperties": true,
          "required": [
            "createdOn",
            "createdBy",
            "updatedOn",
            "updatedBy",
            "isDeleted"
          ],
          "properties": {
            "createdOn": {
              "type": "string",
              "format": "date-time"
            },
            "createdBy": {
              "type": "string"
            },
            "updatedOn": {
              "type": "string",
              "format": "date-time"
            },
            "updatedBy": {
              "type": "string"
            },
            "isDeleted": {
              "type": "boolean"
            }
          }
        },
        "competitorStrengths": {
          "type": "string"
        },
        "competitorFromDate": {
          "type": "string",
          "format": "date"
        },
        "socialMediaPostRate": {
          "anyOf": [
            {
              "type": "integer"
            },
            {
              "type": "null"
            }
          ]
        },
        "competitorThreats": {
          "type": "string"
        },
        "currentRatio": {
          "anyOf": [
            {
              "type": "integer"
            },
            {
              "type": "null"
            }
          ]
        },
        "cashFlowGrowth": {
          "anyOf": [
            {
              "type": "integer"
            },
            {
              "type": "null"
            }
          ]
        },
        "competitorObjectives": {
          "type": "string"
        },
        "netProfitMargin": {
          "anyOf": [
            {
              "type": "integer"
            },
            {
              "type": "null"
            }
          ]
        },
        "competitorWeaknesses": {
          "type": "string"
        },
        "pressMentionsRate": {
          "anyOf": [
            {
              "type": "integer"
            },
            {
              "type": "null"
            }
          ]
        },
        "assetTurnoverRatio": {
          "anyOf": [
            {
              "type": "integer"
            },
            {
              "type": "null"
            }
          ]
        },
        "competitorToDate": {
          "anyOf": [
            {
              "type": "string",
              "format": "date"
            },
            {
              "type": "null"
            }
          ]
        },
        "competitorLeverageOpportunities": {
          "type": "string"
        },
        "assetReturnRatio": {
          "anyOf": [
            {
              "type": "integer"
            },
            {
              "type": "null"
            }
          ]
        },
        "ptoENumber": {
          "anyOf": [
            {
              "type": "integer"
            },
            {
              "type": "null"
            }
          ]
        },
        "adKeywords": {
          "type": "string"
        },
        "adReachRate": {
          "anyOf": [
            {
              "type": "integer"
            },
            {
              "type": "null"
            }
          ]
        },
        "party": {
          "type": "array",
          "items": {
            "type": "string"
          }
        }
      }
    }
  }
}
