{
  "competitorFromDate": "1974-04-08",
  "id": "nisi Excepteur proident",
  "competitorObjectives": "reprehenderit quis Ut",
  "competitorToDate": "1982-12-13",
  "competitorWeaknesses": "laboris eu",
  "socialMediaPostRate": -81810054,
  "auditDetail": {
    "createdOn": "1952-07-02T08:51:07.305Z",
    "createdBy": "voluptate ea do",
    "updatedOn": "1947-07-12T15:48:22.078Z",
    "updatedBy": "quis labore occaecat elit",
    "isDeleted": true
  },
  "adReachRate": 98030473,
  "netProfitMargin": -71262342,
  "pressMentionsRate": -53965059,
  "ptoENumber": 65170518,
  "competitorStrengths": "tempor Excepteur velit",
  "assetTurnoverRatio": -31153242,
  "cashFlowGrowth": 53173359,
  "competitorThreats": "adipisicing aliquip esse eu non",
  "currentRatio": 43893370
}
